{"cert_sha256":"sha256:804c9acae5f53ff8c33b72ea9e8d5ab7cdc5b09a818eb207839f0b2ce054d440","formal_proof_bindings":[{"binding_id":"fire_zpl_language_soundness_v1","checker":"lake env lean Proofs/ZenoPayoffLanguage.lean","claim":"Successful ZPL compilation preserves expression value, emits sound interval bounds, and supports collateral-safe two-party settlement when posted collateral dominates the certified requirements.","lean_toolchain":"leanprover/lean4:v4.27.0","module":"Proofs.ZenoPayoffLanguage","proof_system":"lean4","source_files":[{"path":"lean-mathlib/Proofs/ZenoPayoffLanguage.lean","sha256":"sha256:a63e9bd9063a5db5b3b3dcdfb32b9fa5bafc56449457b4bff64392a8bbc59db2"},{"path":"lean-mathlib/Proofs/CertifiedFinancialMathObjects.lean","sha256":"sha256:d5f2dc8bb3b83221b74ead3dcd19fa8756be2cfc0b612c48dc7f36992c2bcedb"}],"theorems":["compile_correct","compile_no_default","VerifiedPayoff.settlement_safe","firev_accept_settlement_safe","twoPartyObject_conserves"]},{"binding_id":"fire_cal_core_soundness_v1","checker":"lake env lean Proofs/CALCoreSoundness.lean","claim":"FIREVAccept implies SettlementSafe for the modeled CAL/FIRE admission core under the declared object, instance, witness, collateral, delta, conservation, and replay obligations.","lean_toolchain":"leanprover/lean4:v4.27.0","module":"Proofs.CALCoreSoundness","proof_system":"lean4","source_files":[{"path":"lean-mathlib/Proofs/CALCoreSoundness.lean","sha256":"sha256:f8c5b61f84e8efd746ab693774f1cc9dd299bfcddfc6a362db9e1661b5667a6c"},{"path":"lean-mathlib/Proofs/CertifiedFinancialMathObjects.lean","sha256":"sha256:d5f2dc8bb3b83221b74ead3dcd19fa8756be2cfc0b612c48dc7f36992c2bcedb"}],"theorems":["collateral_two_party_no_default","integerEvalOK_within_bounds","fireV_accept_soundness"]},{"binding_id":"fire_zpl_fixed_point_bridge_v1","checker":"lake env lean Proofs/ZenoPayoffPortfolioFixedPointBridge.lean","claim":"Successful FIRE/ZPL compilation composes with fixed-point runtime rounding: floor-decoded settlements are safe under a one-tick lower-side buffer, ceil-decoded settlements are safe under a one-tick upper-side buffer, and posted collateral against those expanded intervals prevents bilateral default.","lean_toolchain":"leanprover/lean4:v4.27.0","module":"Proofs.ZenoPayoffPortfolioFixedPointBridge","proof_system":"lean4","source_files":[{"path":"lean-mathlib/Proofs/FixedPointIntervalBridge.lean","sha256":"sha256:1325124379185e0775510bfc62dfbacc4ba7d87b323c96fb2e0826737674d856"},{"path":"lean-mathlib/Proofs/FixedPointPortfolioBridge.lean","sha256":"sha256:78929edcd9836582404183999265fda3f9b27a279e9be723d2dee8bc46f6d95b"},{"path":"lean-mathlib/Proofs/ZenoPayoffFixedPointBridge.lean","sha256":"sha256:76b56e03f1a24ae30522cc77f2aa513fd416f38dc6f2df8b8a7653ea51bf747b"},{"path":"lean-mathlib/Proofs/ZenoPayoffPortfolioFixedPointBridge.lean","sha256":"sha256:a04c70e144e7c325e8029191577d12938912b0df9a46cc02cc72a6f3199a646b"}],"theorems":["compile_floorDecode_posted_collateral_safe","compile_ceilDecode_posted_collateral_safe","compile_sum_floorDecode_posted_collateral_safe","compile_sum_ceilDecode_posted_collateral_safe"]}],"import_requirements":[{"contract_name":"fee_contract","contract_role":"import:fee_index_v1.fee_final","interface_object_id":"fee_index_v1","interface_output":"fee_final","lower":0,"name":"fee_final","unit":"Index","upper":12}],"ir_hash":"sha256:1d2740320070d63cc487bbc9333d10ca0d6c43e102ac1940bc4daa517a0492ba","object_family":"capped_index_note","object_hash":"sha256:5dda1237873fa880e49b26cf62797f542b3cb195b434c12b35b70b8a59be023f","object_id":"fee_note_v1","object_name":"FeeNote","object_version":"v1","output_guarantees":[{"lower":0,"name":"settlement_payoff","unit":"Amount[zUSD]","upper":77}],"parameter_values":[{"name":"cap_index","value":7},{"name":"n_notional","value":11},{"name":"source_upper","value":12}],"runtime_certificate_summary":{"exact_params":[{"name":"cap_index","value":7},{"name":"n_notional","value":11}],"node_count":5,"operator_tree":{"children":[{"children":[],"lower":11,"name":"n_notional","rule":"exact_param","upper":11,"value":11},{"children":[{"children":[],"lower":0,"name":"fee_final","rule":"source_bound","upper":12},{"children":[],"lower":7,"name":"cap_index","rule":"exact_param","upper":7,"value":7}],"lower":0,"rule":"min","upper":7}],"lower":0,"rule":"mul","upper":77},"root_interval":{"lower":0,"upper":77},"root_rule":"mul","source_bounds":[{"lower":0,"name":"fee_final","upper":12}]},"schema":"zenodex/fire-compile-receipt/v1","source_requirements":[{"lower":0,"name":"fee_final","unit":"Index","upper":12}],"witness_requirements":[{"contract_name":"fee_contract","contract_role":"witness:FeeIndexPacket","freshness":"1 epoch","lower":0,"name":"FeeIndexPacket","upper":12}]}