{"cert_sha256":"sha256:27c1089f28a4673d4b348344f82850b65b4d8ef220dae9277b210df3a4dc09c0","formal_proof_bindings":[{"binding_id":"fire_zpl_language_soundness_v1","checker":"lake env lean Proofs/ZenoPayoffLanguage.lean","claim":"Successful ZPL compilation preserves expression value, emits sound interval bounds, and supports collateral-safe two-party settlement when posted collateral dominates the certified requirements.","lean_toolchain":"leanprover/lean4:v4.27.0","module":"Proofs.ZenoPayoffLanguage","proof_system":"lean4","source_files":[{"path":"lean-mathlib/Proofs/ZenoPayoffLanguage.lean","sha256":"sha256:a63e9bd9063a5db5b3b3dcdfb32b9fa5bafc56449457b4bff64392a8bbc59db2"},{"path":"lean-mathlib/Proofs/CertifiedFinancialMathObjects.lean","sha256":"sha256:d5f2dc8bb3b83221b74ead3dcd19fa8756be2cfc0b612c48dc7f36992c2bcedb"}],"theorems":["compile_correct","compile_no_default","VerifiedPayoff.settlement_safe","firev_accept_settlement_safe","twoPartyObject_conserves"]},{"binding_id":"fire_cal_core_soundness_v1","checker":"lake env lean Proofs/CALCoreSoundness.lean","claim":"FIREVAccept implies SettlementSafe for the modeled CAL/FIRE admission core under the declared object, instance, witness, collateral, delta, conservation, and replay obligations.","lean_toolchain":"leanprover/lean4:v4.27.0","module":"Proofs.CALCoreSoundness","proof_system":"lean4","source_files":[{"path":"lean-mathlib/Proofs/CALCoreSoundness.lean","sha256":"sha256:f8c5b61f84e8efd746ab693774f1cc9dd299bfcddfc6a362db9e1661b5667a6c"},{"path":"lean-mathlib/Proofs/CertifiedFinancialMathObjects.lean","sha256":"sha256:d5f2dc8bb3b83221b74ead3dcd19fa8756be2cfc0b612c48dc7f36992c2bcedb"}],"theorems":["collateral_two_party_no_default","integerEvalOK_within_bounds","fireV_accept_soundness"]},{"binding_id":"fire_zpl_fixed_point_bridge_v1","checker":"lake env lean Proofs/ZenoPayoffPortfolioFixedPointBridge.lean","claim":"Successful FIRE/ZPL compilation composes with fixed-point runtime rounding: floor-decoded settlements are safe under a one-tick lower-side buffer, ceil-decoded settlements are safe under a one-tick upper-side buffer, mixed floor/ceil portfolios are safe under the corresponding per-leg side buffers, and posted collateral against those expanded intervals prevents bilateral default. Runtime delta conservation is exact when the writer leg negates the rounded holder leg, including the integer receipt delta table and its decoded fixed-point interpretation.","lean_toolchain":"leanprover/lean4:v4.27.0","module":"Proofs.ZenoPayoffPortfolioFixedPointBridge","proof_system":"lean4","source_files":[{"path":"lean-mathlib/Proofs/FixedPointIntervalBridge.lean","sha256":"sha256:1325124379185e0775510bfc62dfbacc4ba7d87b323c96fb2e0826737674d856"},{"path":"lean-mathlib/Proofs/FixedPointPortfolioBridge.lean","sha256":"sha256:4d8504ac4df25bc032b3af1b9d17327859e1dc8c358267ab466d44488521ebd0"},{"path":"lean-mathlib/Proofs/ZenoPayoffFixedPointBridge.lean","sha256":"sha256:76b56e03f1a24ae30522cc77f2aa513fd416f38dc6f2df8b8a7653ea51bf747b"},{"path":"lean-mathlib/Proofs/ZenoPayoffPortfolioFixedPointBridge.lean","sha256":"sha256:ab4140d2b68edd61915905d6eccd2ba4691e95ab5b60b5c9d4eb8c2a13af78a8"}],"theorems":["compile_floorDecode_posted_collateral_safe","compile_ceilDecode_posted_collateral_safe","compile_sum_floorDecode_posted_collateral_safe","compile_sum_ceilDecode_posted_collateral_safe","compile_sum_decodeByMode_posted_collateral_safe","compile_sum_decodeByMode_posted_collateral_safe_and_conserves","int_two_party_delta_receipt_conserves","int_two_party_delta_receipt_decode_conserves","int_two_party_delta_receipt_safe_and_conserves","compile_decodeByMode_two_party_delta_conserves","compile_sum_decodeByMode_two_party_delta_conserves"]},{"binding_id":"fire_unified_settlement_v1","checker":"lake env lean Proofs/FIREUnified.lean","claim":"Successful FIRE/ZPL fixed-point portfolio settlement can be packaged as a projectable receipt carrying bilateral solvency and exact zero-sum conservation. Independent receipts compose by addition, with a neutral zero receipt and grouping/order-independent operational projections, and the mode-expanded interval width is exactly the unexpanded width plus one tick per leg.","lean_toolchain":"leanprover/lean4:v4.27.0","module":"Proofs.FIREUnified","proof_system":"lean4","source_files":[{"path":"lean-mathlib/Proofs/FIREUnified.lean","sha256":"sha256:d33861443b7e89124bfe6093e0c7511f0ad57ef132041ee718c555f30d290381"},{"path":"lean-mathlib/Proofs/ZenoPayoffPortfolioFixedPointBridge.lean","sha256":"sha256:ab4140d2b68edd61915905d6eccd2ba4691e95ab5b60b5c9d4eb8c2a13af78a8"},{"path":"lean-mathlib/Proofs/FixedPointPortfolioBridge.lean","sha256":"sha256:4d8504ac4df25bc032b3af1b9d17327859e1dc8c358267ab466d44488521ebd0"}],"theorems":["fire_portfolio_settlement","FIREPortfolioReceipt.combine","compiled_portfolio_to_certified_payoff","fire_single_leg_settlement","FIREPortfolioReceipt.zero","FIREPortfolioReceipt.operationalFields","FIREPortfolioReceipt.combine_zero_operational","FIREPortfolioReceipt.zero_combine_operational","FIREPortfolioReceipt.combine_assoc_operational","FIREPortfolioReceipt.combine_comm_operational","portfolio_interval_width_budget"]}],"import_requirements":[{"contract_name":"hodl_contract","contract_role":"import:hodl_value_v1.hodl_final","interface_object_id":"hodl_value_v1","interface_output":"hodl_final","lower":30,"name":"hodl_final","unit":"Amount[zUSD]","upper":80},{"contract_name":"lpv_contract","contract_role":"import:lp_value_v1.lpv_final","interface_object_id":"lp_value_v1","interface_output":"lpv_final","lower":10,"name":"lpv_final","unit":"Amount[zUSD]","upper":60}],"ir_hash":"sha256:bf1509a7c86dfd9cd2d353133de9abf879f2fdf2279c4bd3114636233e8e7be4","object_family":"capped_lp_loss_cover","object_hash":"sha256:10bfe51a55b6821ca73855e541b79f1e11a2f916cd1e75a5fbea72f8903a911b","object_id":"lp_loss_cover_v1","object_name":"LPLossCover","object_version":"v1","output_guarantees":[{"lower":0,"name":"settlement_payoff","unit":"Amount[zUSD]","upper":80}],"parameter_values":[{"name":"cap_amount","value":40},{"name":"deductible","value":5},{"name":"hodl_lower","value":30},{"name":"hodl_upper","value":80},{"name":"lpv_lower","value":10},{"name":"lpv_upper","value":60},{"name":"n_notional","value":2}],"runtime_certificate_summary":{"exact_params":[{"name":"cap_amount","value":40},{"name":"deductible","value":5},{"name":"n_notional","value":2}],"node_count":11,"operator_tree":{"children":[{"children":[],"lower":2,"name":"n_notional","rule":"exact_param","upper":2,"value":2},{"children":[{"children":[{"children":[{"children":[{"children":[],"lower":30,"name":"hodl_final","rule":"source_bound","upper":80},{"children":[],"lower":10,"name":"lpv_final","rule":"source_bound","upper":60}],"lower":-30,"rule":"sub","upper":70},{"children":[],"lower":5,"name":"deductible","rule":"exact_param","upper":5,"value":5}],"lower":-35,"rule":"sub","upper":65},{"children":[],"lower":0,"rule":"const","upper":0,"value":0}],"lower":0,"rule":"max","upper":65},{"children":[],"lower":40,"name":"cap_amount","rule":"exact_param","upper":40,"value":40}],"lower":0,"rule":"min","upper":40}],"lower":0,"rule":"mul","upper":80},"root_interval":{"lower":0,"upper":80},"root_rule":"mul","source_bounds":[{"lower":30,"name":"hodl_final","upper":80},{"lower":10,"name":"lpv_final","upper":60}]},"schema":"zenodex/fire-compile-receipt/v1","source_requirements":[{"lower":30,"name":"hodl_final","unit":"Amount[zUSD]","upper":80},{"lower":10,"name":"lpv_final","unit":"Amount[zUSD]","upper":60}],"witness_requirements":[{"contract_name":"hodl_contract","contract_role":"witness:HODLValuePacket","freshness":"1 epoch","lower":30,"name":"HODLValuePacket","upper":80},{"contract_name":"lpv_contract","contract_role":"witness:LPValuePacket","freshness":"1 epoch","lower":10,"name":"LPValuePacket","upper":60}]}